title,views,duaration,img url
一颗黄豆到一滴酱油传统手工酿造酱油Traditional handicraft.Turn a soybean seed into a drop of soy sauce ▎Liziqi Channel,"3,874,061 views",11:04,/yts/img/pixel-vfl3z5WfW.gif
"In the cold winter,eat ginger,can warm the whole day/正值寒冬，吃点生姜，就能暖和一整天！|Liziqi Channel","4,428,521 views",10:38,/yts/img/pixel-vfl3z5WfW.gif
"Let me ask you, what would you eat on snowy days if not hot pot? ▎Snowy days go well with hot pot❤","5,952,566 views",9:41,/yts/img/pixel-vfl3z5WfW.gif
"Boil soybean milk, steamed purple potato cake, eating a good breakfast is a must|Liziqi Channel","5,059,147 views",6:43,/yts/img/pixel-vfl3z5WfW.gif
Kumiss and Roasted Whole Lamb make you feel like paradise.| Liziqi Channel,"4,633,312 views",10:16,/yts/img/pixel-vfl3z5WfW.gif
"So this video called the life of chilli? chopped chili fish head,red oil sheet jelly| Liziqi Channel","7,461,685 views",11:32,/yts/img/pixel-vfl3z5WfW.gif
秋天就是坚果的主场呀~板栗甜，橡果香！▏Autumn is the home of nuts，Chinese chestnut is sweet | Liziqi Channel,"5,980,382 views",8:41,/yts/img/pixel-vfl3z5WfW.gif
趁着晒谷子这些天，鼓捣了一堆温馨有趣的小玩意儿  | Liziqi Channel,"7,059,583 views",11:03,/yts/img/pixel-vfl3z5WfW.gif
"月儿圆圆，稻米飘香，正逢农家收谷忙Full Moon, Fragrance of Ripe Rice, Farmers Busy Harvesting Crops | Liziqi Channel","10,802,810 views",10:27,/yts/img/pixel-vfl3z5WfW.gif
金黄的季节，载满了收获的喜悦和玉米的香甜 Corn | Liziqi Channel,"12,116,778 views",9:16,/yts/img/pixel-vfl3z5WfW.gif
Hang a Quaint Lantern that Perfectly Befits the Peach Dishes on the Table,"9,444,161 views",9:27,/yts/img/pixel-vfl3z5WfW.gif
"Peanut and melon seeds, dried meat, dried fruit, snowflake cake - snacks for Spring Festival","40,507,070 views",10:12,/yts/img/pixel-vfl3z5WfW.gif
"It’s a red mountain, and in the fall, it’s natural to make some sweet persimmons.","36,464,859 views",5:14,/yts/img/pixel-vfl3z5WfW.gif
Using bamboo to make some sophisticated old furniture——Bamboo Sofa,"30,973,607 views",6:46,/yts/img/pixel-vfl3z5WfW.gif
"Liuzhou ""Luosifen"": Slurpy, Spicy, and Absolutely Satisfying | Liziqi Channel","21,781,727 views",10:06,/yts/img/pixel-vfl3z5WfW.gif
"Ancient Oriental methods of the Sericulture, the solution to the cold (Silk quilt)","19,035,231 views",6:49,/yts/img/pixel-vfl3z5WfW.gif
"In the late autumn when the chill is getting thicker, the honey citron tea in the bowl is warm.","18,855,806 views",3:19,/yts/img/pixel-vfl3z5WfW.gif
"Changbai Mountain Ginseng Honey: While all the other Ginsengs are Bitter, I am sweet","17,783,915 views",5:00,/yts/img/pixel-vfl3z5WfW.gif
Go through the whole winter with spicy veggies with bean curd paste in a hotpot,"17,654,276 views",6:32,/yts/img/pixel-vfl3z5WfW.gif
黄桃罐头：炎炎夏日，来罐冰镇黄桃罐头怎么样？,"17,131,183 views",4:42,/yts/img/pixel-vfl3z5WfW.gif
"Eat a lot of food, soak the summer of the fruity fruit - passion fruit","16,685,466 views",5:54,/yts/img/pixel-vfl3z5WfW.gif
The sweetness of roast sweet potato and the spiciness of spicy and sour noodles,"16,353,039 views",6:32,/yts/img/pixel-vfl3z5WfW.gif
"Grab the tomatoes before they drop, and make something delicious - ruby ​​ketchup","15,775,979 views",9:17,/yts/img/pixel-vfl3z5WfW.gif
一颗黄豆到一滴酱油传统手工酿造酱油Traditional handicraft.Turn a soybean seed into a drop of soy sauce ▎Liziqi Channel,"3,874,061 views",11:04,/yts/img/pixel-vfl3z5WfW.gif
"In the cold winter,eat ginger,can warm the whole day/正值寒冬，吃点生姜，就能暖和一整天！|Liziqi Channel","4,428,521 views",10:38,/yts/img/pixel-vfl3z5WfW.gif
"Let me ask you, what would you eat on snowy days if not hot pot? ▎Snowy days go well with hot pot❤","5,952,566 views",9:41,/yts/img/pixel-vfl3z5WfW.gif
Fear not the harsh winter with the cloak made from soft and fluffy wool,"11,877,848 views",5:49,/yts/img/pixel-vfl3z5WfW.gif
"Happiness-filled family dinner, fortune-and-wellness-filled year ahead - New Year Dinner","8,346,565 views",10:03,/yts/img/pixel-vfl3z5WfW.gif
"Peanut and melon seeds, dried meat, dried fruit, snowflake cake - snacks for Spring Festival","40,507,070 views",10:12,/yts/img/pixel-vfl3z5WfW.gif
Indispensable  food for the Spring Festival——Sauced meat,"7,505,981 views",6:23,/yts/img/pixel-vfl3z5WfW.gif
Must-eat savory meat stew in the winter!,"6,119,076 views",5:00,/yts/img/pixel-vfl3z5WfW.gif
Go through the whole winter with spicy veggies with bean curd paste in a hotpot,"17,654,276 views",6:32,/yts/img/pixel-vfl3z5WfW.gif
The sweetness of roast sweet potato and the spiciness of spicy and sour noodles,"16,353,039 views",6:32,/yts/img/pixel-vfl3z5WfW.gif
"Providing warmth in the winter, quietly hidden in the bubbles of old brown sugar","11,485,568 views",5:50,/yts/img/pixel-vfl3z5WfW.gif
"Spiced beef sauce, made with wild mushrooms and free ranged chicken oil. Doubled delicious!","10,149,841 views",6:19,/yts/img/pixel-vfl3z5WfW.gif
"Cool and sweet berry ice cream, the taste of summer | Liziqi Channel","14,651,234 views",7:53,/yts/img/pixel-vfl3z5WfW.gif
The best food for summer------Many kinds of jam.,"13,459,082 views",9:27,/yts/img/pixel-vfl3z5WfW.gif
I planted shiitake mushrooms in the mountain! | Liziqi Channel,"13,376,783 views",6:37,/yts/img/pixel-vfl3z5WfW.gif
Best Time of Year to Comsume Juicy and Tender Bamboo Shoots; Pick As Much As You Like,"13,210,041 views",7:25,/yts/img/pixel-vfl3z5WfW.gif
How to make Salted Duck Egg Yolk Sauce（Chinese Mayonnaise）|Liziqi Channel,"12,625,233 views",6:09,/yts/img/pixel-vfl3z5WfW.gif
"When you missed the good time to dig wild vegetables, you also missed this spring.","12,450,004 views",6:57,/yts/img/pixel-vfl3z5WfW.gif
"Congee with pickled mustard plant stem  and plum blossom pastries, a simple home-cooked breakfast","11,576,337 views",5:31,/yts/img/pixel-vfl3z5WfW.gif
"Peanut and melon seeds, dried meat, dried fruit, snowflake cake - snacks for Spring Festival","40,507,070 views",10:12,/yts/img/pixel-vfl3z5WfW.gif
Go through the whole winter with spicy veggies with bean curd paste in a hotpot,"17,654,276 views",6:32,/yts/img/pixel-vfl3z5WfW.gif
The sweetness of roast sweet potato and the spiciness of spicy and sour noodles,"16,353,039 views",6:32,/yts/img/pixel-vfl3z5WfW.gif
"Providing warmth in the winter, quietly hidden in the bubbles of old brown sugar","11,485,568 views",5:50,/yts/img/pixel-vfl3z5WfW.gif
"Ancient Oriental methods of the Sericulture, the solution to the cold (Silk quilt)","19,035,231 views",6:49,/yts/img/pixel-vfl3z5WfW.gif
"Boil soybean milk, steamed purple potato cake, eating a good breakfast is a must|Liziqi Channel","5,059,147 views",6:43,/yts/img/pixel-vfl3z5WfW.gif
Kumiss and Roasted Whole Lamb make you feel like paradise.| Liziqi Channel,"4,633,312 views",10:16,/yts/img/pixel-vfl3z5WfW.gif
"So this video called the life of chilli? chopped chili fish head,red oil sheet jelly| Liziqi Channel","7,461,685 views",11:32,/yts/img/pixel-vfl3z5WfW.gif
秋天就是坚果的主场呀~板栗甜，橡果香！▏Autumn is the home of nuts，Chinese chestnut is sweet | Liziqi Channel,"5,980,382 views",8:41,/yts/img/pixel-vfl3z5WfW.gif
趁着晒谷子这些天，鼓捣了一堆温馨有趣的小玩意儿  | Liziqi Channel,"7,059,583 views",11:03,/yts/img/pixel-vfl3z5WfW.gif
"月儿圆圆，稻米飘香，正逢农家收谷忙Full Moon, Fragrance of Ripe Rice, Farmers Busy Harvesting Crops | Liziqi Channel","10,802,810 views",10:27,/yts/img/pixel-vfl3z5WfW.gif
金黄的季节，载满了收获的喜悦和玉米的香甜 Corn | Liziqi Channel,"12,116,778 views",9:16,/yts/img/pixel-vfl3z5WfW.gif
"Ancient Oriental methods of the Sericulture, the solution to the cold (Silk quilt)","19,035,231 views",6:49,/yts/img/pixel-vfl3z5WfW.gif
"It’s a red mountain, and in the fall, it’s natural to make some sweet persimmons.","36,464,859 views",5:14,/yts/img/pixel-vfl3z5WfW.gif
Using bamboo to make some sophisticated old furniture——Bamboo Sofa,"30,973,607 views",6:46,/yts/img/pixel-vfl3z5WfW.gif
"Slow-Boiled Autumn Pear Paste, Tasty, Cough Relief & Good for Lung","8,459,005 views",5:59,/yts/img/pixel-vfl3z5WfW.gif
"Woodblock printing, engraved with the essence of the ancient Chinese culture","5,128,370 views",5:07,/yts/img/pixel-vfl3z5WfW.gif
Hang a Quaint Lantern that Perfectly Befits the Peach Dishes on the Table,"9,444,161 views",9:27,/yts/img/pixel-vfl3z5WfW.gif
"Liuzhou ""Luosifen"": Slurpy, Spicy, and Absolutely Satisfying | Liziqi Channel","21,781,727 views",10:06,/yts/img/pixel-vfl3z5WfW.gif
"It's again that season when the fruit and vegetables are too many to eat, such a headache~","12,763,991 views",7:32,/yts/img/pixel-vfl3z5WfW.gif
"Grab the tomatoes before they drop, and make something delicious - ruby ​​ketchup","15,775,979 views",9:17,/yts/img/pixel-vfl3z5WfW.gif
"丨Making Use of Every Part of the Lotus: Flowers, Leaves, and Roots | Liziqi Channel","12,420,367 views",8:42,/yts/img/pixel-vfl3z5WfW.gif
"Cool and sweet berry ice cream, the taste of summer | Liziqi Channel","14,651,234 views",7:53,/yts/img/pixel-vfl3z5WfW.gif
The best food for summer------Many kinds of jam.,"13,459,082 views",9:27,/yts/img/pixel-vfl3z5WfW.gif
I planted shiitake mushrooms in the mountain! | Liziqi Channel,"13,376,783 views",6:37,/yts/img/pixel-vfl3z5WfW.gif
"During the farming season, drink some homemade beer together for cool and appetite.","9,434,307 views",11:40,/yts/img/pixel-vfl3z5WfW.gif
The routine thing you shall never miss every summer- to eat green plums,"10,631,570 views",8:42,/yts/img/pixel-vfl3z5WfW.gif
Exquisite drunken crabs: freshness known only when drunk,"8,606,759 views",5:48,/yts/img/pixel-vfl3z5WfW.gif
How to make a Chinese herbal tea? 逍遥草本茶，泡一杯自在逍遥！|Liziqi channel,"7,768,196 views",4:07,/yts/img/pixel-vfl3z5WfW.gif
Best Time of Year to Comsume Juicy and Tender Bamboo Shoots; Pick As Much As You Like,"13,210,041 views",7:25,/yts/img/pixel-vfl3z5WfW.gif
Picking Out Blooming Flowers to Make Aromatic Dew|Liziqi Channel,"6,407,078 views",4:31,/yts/img/pixel-vfl3z5WfW.gif
How to make Salted Duck Egg Yolk Sauce（Chinese Mayonnaise）|Liziqi Channel,"12,625,233 views",6:09,/yts/img/pixel-vfl3z5WfW.gif
"When you missed the good time to dig wild vegetables, you also missed this spring.","12,450,004 views",6:57,/yts/img/pixel-vfl3z5WfW.gif
Riding a Horse to Find Magnolia Liliflora Blossoms for my lovely fans,"6,828,334 views",5:58,/yts/img/pixel-vfl3z5WfW.gif
The Scholar's Four Jewels of China,"6,561,956 views",11:41,/yts/img/pixel-vfl3z5WfW.gif
Drops of peach blossoms. Simmered into a pot of early spring dessert - peach gum,"4,053,184 views",4:52,/yts/img/pixel-vfl3z5WfW.gif
"Another year of Cerasus blossom season, come to the pot Cerasus tea又是一年樱花季，来壶樱花茶吧|Liziqi channel","4,838,338 views",4:40,/yts/img/pixel-vfl3z5WfW.gif
How to cook fish in a traditional Chinese way? 收取人间一片白，焖得一罐鱼儿香——古法焖雪水鱼|Liziqi channel,"5,271,735 views",5:00,/yts/img/pixel-vfl3z5WfW.gif
"Special pigeon soup,it's good for you when the spring comes春暖花开，来一碗梅花鸽子汤补补元气！Liziqi channel","2,000,589 views",3:55,/yts/img/pixel-vfl3z5WfW.gif
Sanzi (Fried Dough Twist),"5,556,920 views",4:34,/yts/img/pixel-vfl3z5WfW.gif
"When spring comes, let’s enjoy a pot of Sichuan stew dried ribs春暖花开，来上一锅享誉巴蜀的盐排骨可好？Liziqi channel","4,252,582 views",4:37,/yts/img/pixel-vfl3z5WfW.gif
